name,score,review
연세신앤송이비인후과의원,1,왜 그런 직원들을 계속 쓰는지 모르겠는데 의사선생님들은 엄청 친절한데 간호사들이 다 엄청 불친절해서 갈때마다  기분이 상합니다 집에서 가까워서 자주 가는데 몇년전부터 한결같네요 리뷰 관리를 한다면 직원교육이나 직원들부터 다 바꾸셔야할것같습니다  단한명도 친절한 간호사가 없이 다 문열고 들어오자마자 왜왔냐는듯 째려보는 불만가득한 표정으로 환자를 맞이합니다 
연세신앤송이비인후과의원,5,"독감 걸려서 갔는데, 친절하게 진료 잘 봐주시고 간호사분들도 친절하셨어요"
오레노카츠 선릉점,1,
오레노카츠 선릉점,5,점심시간이라 웨이팅 할까 봐 걱정했는데 웨이팅 없어서 좋았고 선릉점도 맛있었어요~
오레노카츠 선릉점,5,생돈까스 체다 크림 치즈 돈까스 둘다 ㅈㄴ맛탱! 치즈는 꾸덕한게 엄청 진해요 ㅎ 돈까스 속살이 꽉 차 있고 잘 튀겨졌습니다 ㅎㅎ
오레노카츠 선릉점,5,주말에도 점심특선 주문되고 정식세트에 있는 생카츠를 다른 돈까스로 변경됩니다~(저는 치돈으로 바꾸고 2500원 추가했습니다) 치돈 치즈 향이 찐해서 노란치즈 진짜 좋아하는 분이 드시면 좋을 거 같아요! 아니면 느끼할듯요ㅎㅎ 전반적으로 만족했습니다! 
오레노카츠 선릉점,1,호천당 시절엔 친절하고 좋았는데 상호 바뀌고 나서 별로입니다. 문 열 때부터 단골인데요. 점심에 조금 늦게 가면 튀긴지 좀 된 돈까스 받아요. 만원 넘고 눅눅한 돈까스 먹어본 적 있습니다.  오늘 점심에 가려다 말았어요. 4인석 앉고 싶다니까 둘이라서 안 된다며 거의 합석시키네요. 점심에 바쁜 건 이해하는데 이 시국에 자리 있는데도 떨어져 앉고 싶다는 손님...
오레노카츠 선릉점,1,
오레노카츠 선릉점,5,점심시간이라 웨이팅 할까 봐 걱정했는데 웨이팅 없어서 좋았고 선릉점도 맛있었어요~
오레노카츠 선릉점,5,생돈까스 체다 크림 치즈 돈까스 둘다 ㅈㄴ맛탱! 치즈는 꾸덕한게 엄청 진해요 ㅎ 돈까스 속살이 꽉 차 있고 잘 튀겨졌습니다 ㅎㅎ
오레노카츠 선릉점,5,주말에도 점심특선 주문되고 정식세트에 있는 생카츠를 다른 돈까스로 변경됩니다~(저는 치돈으로 바꾸고 2500원 추가했습니다) 치돈 치즈 향이 찐해서 노란치즈 진짜 좋아하는 분이 드시면 좋을 거 같아요! 아니면 느끼할듯요ㅎㅎ 전반적으로 만족했습니다! 
오레노카츠 선릉점,1,호천당 시절엔 친절하고 좋았는데 상호 바뀌고 나서 별로입니다. 문 열 때부터 단골인데요. 점심에 조금 늦게 가면 튀긴지 좀 된 돈까스 받아요. 만원 넘고 눅눅한 돈까스 먹어본 적 있습니다.  오늘 점심에 가려다 말았어요. 4인석 앉고 싶다니까 둘이라서 안 된다며 거의 합석시키네요. 점심에 바쁜 건 이해하는데 이 시국에 자리 있는데도 떨어져 앉고 싶다는 손님...
동경에서 먹었던 규동,2,먹는물 따르는 정수기 바로옆에 더러운 빗자루와 쓰레받기 너무 찝찝해요. 위생적으로나 미관상으로나.. 바로앞에 쓰레기통 종이컵수거까지 몽땅.. 고민을 하셔야할듯해요 홀 관리도 너무 안되는거같아요 손님나가고 아무도 상도 안닦고 바닥에도 흘린 음식물들이 계속 방치되네요
동경에서 먹었던 규동,5,음식이 조금 짜긴 하지만 가격도 나쁘지 않고 맛있게 먹었어요. 직원들도 친절하고 내부도 깨끗해서 좋아요.
동경에서 먹었던 규동,1,제가 동경에서 먹었던 규동은 양이 많고 저렴했어요
